{
  "apiVersion": "cymonkey.browser-package/v1alpha1",
  "kind": "BrowserExtensionProduct",
  "metadata": {
    "id": "camera-kit",
    "name": "Cymonkey Camera Kit Browser Extension"
  },
  "spec": {
    "browsers": ["chrome", "edge"],
    "packages": [
      {
        "directory": "pkg/snapchat-camera-kit-cymonkey",
        "build": "build:sandbox"
      }
    ]
  }
}
